{
  "id": "insufficient-evidence",
  "description": "Sparse report forces needs_more_evidence then a cautious result.",
  "report": {
    "schema_version": "1.3.0",
    "report_id": "report-eval-insufficient-evidence",
    "collected_at": "2026-07-23T10:00:00Z",
    "collector": {
      "name": "effexorwinpe-collector",
      "version": "eval-fixture"
    },
    "environment": {
      "runtime_os": "windows",
      "runtime_arch": "amd64"
    },
    "hardware": {
      "firmware_mode": "uefi",
      "system": {
        "manufacturer": "Example OEM",
        "model": "Anon-Notebook"
      },
      "processor": {
        "name": "Example CPU",
        "cores": 4,
        "logical_processors": 8
      },
      "memory": {
        "total_physical_bytes": 17179869184
      },
      "network_adapters": [
        {
          "name": "Example NIC",
          "status": "connected",
          "status_code": 2
        }
      ]
    },
    "storage": {
      "disks": [
        {
          "number": 0,
          "friendly_name": "Example NVMe",
          "bus_type": "NVMe",
          "size_bytes": 549755813888,
          "partition_style": "GPT",
          "health_status": "Healthy",
          "operational_status": "Online",
          "is_boot": false,
          "is_system": false
        }
      ],
      "drive_health": null,
      "partitions": [
        {
          "disk_number": 0,
          "partition_number": 3,
          "drive_letter": "C",
          "size_bytes": 429496729600,
          "type": "Basic",
          "is_active": false
        }
      ],
      "bitlocker_volumes": null,
      "bitlocker_inventory": {
        "status": "unavailable"
      }
    },
    "boot": {
      "firmware_mode": "uefi",
      "bcd_stores": null
    },
    "windows_installations": null,
    "checks": [
      {
        "id": "collector.runtime",
        "status": "ok",
        "summary": "collector running"
      },
      {
        "id": "storage.smart",
        "status": "unknown",
        "summary": "unavailable"
      },
      {
        "id": "boot.bcd",
        "status": "unknown",
        "summary": "unavailable"
      }
    ],
    "privacy": {
      "contains_personal_data": false,
      "excluded_by_default": [
        "hostname",
        "user profiles"
      ]
    }
  },
  "session": {
    "schema_version": "0.2.0",
    "session_id": "session-report-eval-insufficient-evidence",
    "report_id": "report-eval-insufficient-evidence",
    "created_at": "2026-07-23T10:00:00Z",
    "updated_at": "2026-07-23T10:00:00Z",
    "symptoms": [],
    "answers": [],
    "events": [
      {
        "at": "2026-07-23T10:00:00Z",
        "kind": "session_started"
      }
    ]
  },
  "provider_rounds": [
    {
      "schema_version": "",
      "report_id": "",
      "generated_at": "0001-01-01T00:00:00Z",
      "state": "needs_more_evidence",
      "round": 0,
      "evidence_requests": [
        {
          "id": "req-sources",
          "operation": "review_missing_sources",
          "arguments": {},
          "reason": "Many providers are unavailable.",
          "expected_information": "Which checks failed.",
          "privacy_class": "machine_inventory",
          "timeout_seconds": 30
        }
      ],
      "audit_timeline": null,
      "limitations": [
        "Initial evidence is too sparse."
      ]
    },
    {
      "schema_version": "",
      "report_id": "",
      "generated_at": "0001-01-01T00:00:00Z",
      "state": "completed",
      "round": 0,
      "assessment": {
        "schema_version": "0.2.0",
        "report_id": "report-eval-insufficient-evidence",
        "generated_at": "2026-07-23T10:00:00Z",
        "mode": "online_agent",
        "summary": {
          "headline": "Collected evidence is insufficient for a device-specific claim",
          "highest_severity": "unknown",
          "finding_count": 1
        },
        "findings": [
          {
            "id": "evidence.insufficient",
            "title": "Collected evidence is insufficient for a device-specific claim",
            "severity": "unknown",
            "confidence": "high",
            "rationale": "Too many sources are missing to assert hardware or OS health.",
            "evidence_refs": [
              "checks[1].status",
              "checks[2].status"
            ],
            "source_refs": []
          }
        ],
        "questions": [],
        "next_steps": [
          {
            "id": "step-review_missing_sources",
            "title": "Continue read-only inspection",
            "operation": "review_missing_sources",
            "risk": "read_only",
            "requires_confirmation": false,
            "rationale": "Stay within the closed read-only catalog."
          }
        ],
        "limitations": [
          "Refuse strong claims when evidence remains incomplete."
        ],
        "sources": []
      },
      "evidence_requests": [],
      "audit_timeline": null,
      "limitations": [
        "Refuse strong claims when evidence remains incomplete."
      ]
    }
  ],
  "evidence_catalog": {
    "review_missing_sources": {
      "request_id": "",
      "operation": "",
      "collected_at": "0001-01-01T00:00:00Z",
      "facts": {
        "missing_checks": 2
      },
      "evidence_refs": [
        "checks[1].status",
        "checks[2].status"
      ]
    }
  },
  "expected": {
    "final_state": "completed",
    "final_round": 2,
    "finding_ids": [
      "evidence.insufficient"
    ],
    "forbidden_claims": [
      "hardware is fine",
      "os is healthy",
      "powershell"
    ],
    "required_evidence_refs": [
      "checks[1].status"
    ],
    "allowed_operation_ids": [
      "review_missing_sources"
    ]
  }
}
