{
  "id": "missing-smart",
  "description": "Missing SMART must lower confidence, not imply health.",
  "report": {
    "schema_version": "1.3.0",
    "report_id": "report-eval-missing-smart",
    "collected_at": "2026-07-23T10:00:00Z",
    "collector": {
      "name": "effexorwinpe-collector",
      "version": "eval-fixture"
    },
    "environment": {
      "runtime_os": "windows",
      "runtime_arch": "amd64"
    },
    "hardware": {
      "firmware_mode": "uefi",
      "system": {
        "manufacturer": "Example OEM",
        "model": "Anon-Notebook"
      },
      "processor": {
        "name": "Example CPU",
        "cores": 4,
        "logical_processors": 8
      },
      "memory": {
        "total_physical_bytes": 17179869184
      },
      "network_adapters": [
        {
          "name": "Example NIC",
          "status": "connected",
          "status_code": 2
        }
      ]
    },
    "storage": {
      "disks": [
        {
          "number": 0,
          "friendly_name": "Example NVMe",
          "bus_type": "NVMe",
          "size_bytes": 549755813888,
          "partition_style": "GPT",
          "health_status": "Healthy",
          "operational_status": "Online",
          "is_boot": false,
          "is_system": false
        }
      ],
      "drive_health": [],
      "partitions": [
        {
          "disk_number": 0,
          "partition_number": 3,
          "drive_letter": "C",
          "size_bytes": 429496729600,
          "type": "Basic",
          "is_active": false
        }
      ],
      "bitlocker_volumes": [],
      "bitlocker_inventory": {
        "status": "ok"
      }
    },
    "boot": {
      "firmware_mode": "uefi",
      "bcd_stores": [
        {
          "path": "\\EFI\\Microsoft\\Boot\\BCD",
          "kind": "system"
        }
      ]
    },
    "windows_installations": [
      {
        "root": "C:\\Windows",
        "system_hive": "C:\\Windows\\System32\\config\\SYSTEM",
        "software_hive": "C:\\Windows\\System32\\config\\SOFTWARE",
        "version": {
          "product_name": "Windows 11 Pro",
          "display_version": "24H2",
          "build": "26100"
        }
      }
    ],
    "checks": [
      {
        "id": "collector.runtime",
        "status": "ok",
        "summary": "collector running"
      },
      {
        "id": "storage.smart",
        "status": "unknown",
        "summary": "SMART provider unavailable"
      }
    ],
    "privacy": {
      "contains_personal_data": false,
      "excluded_by_default": [
        "hostname",
        "user profiles"
      ]
    }
  },
  "session": {
    "schema_version": "0.2.0",
    "session_id": "session-report-eval-missing-smart",
    "report_id": "report-eval-missing-smart",
    "created_at": "2026-07-23T10:00:00Z",
    "updated_at": "2026-07-23T10:00:00Z",
    "symptoms": [],
    "answers": [],
    "events": [
      {
        "at": "2026-07-23T10:00:00Z",
        "kind": "session_started"
      }
    ]
  },
  "provider_rounds": [
    {
      "schema_version": "",
      "report_id": "",
      "generated_at": "0001-01-01T00:00:00Z",
      "state": "completed",
      "round": 0,
      "assessment": {
        "schema_version": "0.2.0",
        "report_id": "report-eval-missing-smart",
        "generated_at": "2026-07-23T10:00:00Z",
        "mode": "online_agent",
        "summary": {
          "headline": "SMART counters are unavailable",
          "highest_severity": "unknown",
          "finding_count": 1
        },
        "findings": [
          {
            "id": "storage.smart-missing",
            "title": "SMART counters are unavailable",
            "severity": "unknown",
            "confidence": "high",
            "rationale": "Missing SMART does not prove the disk is healthy.",
            "evidence_refs": [
              "checks[1].status"
            ],
            "source_refs": []
          }
        ],
        "questions": [],
        "next_steps": [
          {
            "id": "step-review_missing_sources",
            "title": "Continue read-only inspection",
            "operation": "review_missing_sources",
            "risk": "read_only",
            "requires_confirmation": false,
            "rationale": "Stay within the closed read-only catalog."
          }
        ],
        "limitations": [
          "Unavailable SMART evidence blocks strong storage conclusions."
        ],
        "sources": []
      },
      "evidence_requests": [],
      "audit_timeline": null,
      "limitations": [
        "Unavailable SMART evidence blocks strong storage conclusions."
      ]
    }
  ],
  "evidence_catalog": {},
  "expected": {
    "final_state": "completed",
    "final_round": 1,
    "finding_ids": [
      "storage.smart-missing"
    ],
    "forbidden_claims": [
      "proven healthy",
      "no problems",
      "powershell"
    ],
    "required_evidence_refs": [
      "checks[1].status"
    ],
    "allowed_operation_ids": [
      "review_missing_sources"
    ]
  }
}
